{
  "record_id": "PORTFOLIO-0035J-002",
  "version": "1.0.0",
  "as_of": "2026-07-19T12:00:00+00:00",
  "portfolio": {
    "portfolio_id": "PORT-000002",
    "name": "Concentrated specialist supply portfolio",
    "owner_id": "USR-PORT-01",
    "currency": "GBP",
    "annual_spend": 1000000,
    "review_frequency_days": 90
  },
  "suppliers": [
    {
      "supplier_id": "SUP-000010",
      "legal_name": "Specialist Primary Ltd",
      "assurance_status": "QUALIFIED",
      "approved_scope_status": "CURRENT",
      "panel_status": "ACTIVE",
      "annual_spend": 550000,
      "spend_percent": 55,
      "critical_categories": [
        "SPECIALIST"
      ],
      "regions": [
        "GB"
      ],
      "sites": [
        "SITE-0"
      ],
      "performance": {
        "quality_score": 90,
        "delivery_score": 94,
        "responsiveness_score": 92,
        "evidence_score": 95,
        "sample_size": 24,
        "period": "2026-H1"
      },
      "sla": {
        "on_time_in_full_percent": 97,
        "target_on_time_in_full_percent": 95,
        "evidence_response_days": 3,
        "target_evidence_response_days": 5,
        "open_overdue_corrective_actions": 0
      },
      "commercial": {
        "currency": "GBP",
        "purchase_cost": 132600.0,
        "landed_cost": 13600.0,
        "assurance_cost": 5100.0,
        "operational_cost": 6800.0,
        "risk_adjusted_cost": 8500.0,
        "exit_cost": 3400.0,
        "total_cost": 170000,
        "payment_terms_days": 30,
        "price_valid_until": "2026-12-31"
      },
      "continuity": {
        "bcp_status": "TESTED",
        "last_tested_at": "2026-05-01T09:00:00+00:00",
        "recovery_time_hours": 48,
        "capacity_status": "AVAILABLE"
      },
      "marketplace": {
        "commercial_eligible": true,
        "decision_id": "MCE-SUP-000010",
        "reviewer_id": "USR-COM-01",
        "approver_id": "USR-COM-02",
        "decided_at": "2026-07-10T10:00:00+00:00"
      }
    },
    {
      "supplier_id": "SUP-000011",
      "legal_name": "Qualified Alternative Ltd",
      "assurance_status": "QUALIFIED",
      "approved_scope_status": "CURRENT",
      "panel_status": "ACTIVE",
      "annual_spend": 300000,
      "spend_percent": 30,
      "critical_categories": [
        "SPECIALIST"
      ],
      "regions": [
        "GB"
      ],
      "sites": [
        "SITE-1"
      ],
      "performance": {
        "quality_score": 90,
        "delivery_score": 94,
        "responsiveness_score": 92,
        "evidence_score": 95,
        "sample_size": 24,
        "period": "2026-H1"
      },
      "sla": {
        "on_time_in_full_percent": 97,
        "target_on_time_in_full_percent": 95,
        "evidence_response_days": 3,
        "target_evidence_response_days": 5,
        "open_overdue_corrective_actions": 0
      },
      "commercial": {
        "currency": "GBP",
        "purchase_cost": 144300.0,
        "landed_cost": 14800.0,
        "assurance_cost": 5550.0,
        "operational_cost": 7400.0,
        "risk_adjusted_cost": 9250.0,
        "exit_cost": 3700.0,
        "total_cost": 185000,
        "payment_terms_days": 30,
        "price_valid_until": "2026-12-31"
      },
      "continuity": {
        "bcp_status": "TESTED",
        "last_tested_at": "2026-05-01T09:00:00+00:00",
        "recovery_time_hours": 48,
        "capacity_status": "AVAILABLE"
      },
      "marketplace": {
        "commercial_eligible": true,
        "decision_id": "MCE-SUP-000011",
        "reviewer_id": "USR-COM-01",
        "approver_id": "USR-COM-02",
        "decided_at": "2026-07-10T10:00:00+00:00"
      }
    },
    {
      "supplier_id": "SUP-000012",
      "legal_name": "Ancillary Services Ltd",
      "assurance_status": "QUALIFIED",
      "approved_scope_status": "CURRENT",
      "panel_status": "ACTIVE",
      "annual_spend": 150000,
      "spend_percent": 15,
      "critical_categories": [
        "SUPPORT"
      ],
      "regions": [
        "GB"
      ],
      "sites": [
        "SITE-2"
      ],
      "performance": {
        "quality_score": 90,
        "delivery_score": 94,
        "responsiveness_score": 92,
        "evidence_score": 95,
        "sample_size": 24,
        "period": "2026-H1"
      },
      "sla": {
        "on_time_in_full_percent": 97,
        "target_on_time_in_full_percent": 95,
        "evidence_response_days": 3,
        "target_evidence_response_days": 5,
        "open_overdue_corrective_actions": 0
      },
      "commercial": {
        "currency": "GBP",
        "purchase_cost": 54600.0,
        "landed_cost": 5600.0,
        "assurance_cost": 2100.0,
        "operational_cost": 2800.0,
        "risk_adjusted_cost": 3500.0,
        "exit_cost": 1400.0,
        "total_cost": 70000,
        "payment_terms_days": 30,
        "price_valid_until": "2026-12-31"
      },
      "continuity": {
        "bcp_status": "TESTED",
        "last_tested_at": "2026-05-01T09:00:00+00:00",
        "recovery_time_hours": 48,
        "capacity_status": "AVAILABLE"
      },
      "marketplace": {
        "commercial_eligible": true,
        "decision_id": "MCE-SUP-000012",
        "reviewer_id": "USR-COM-01",
        "approver_id": "USR-COM-02",
        "decided_at": "2026-07-10T10:00:00+00:00"
      }
    }
  ],
  "categories": [
    {
      "category_id": "CAT-SPEC",
      "name": "Specialist material",
      "critical": true,
      "annual_spend": 850000,
      "primary_supplier_id": "SUP-000010",
      "approved_supplier_ids": [
        "SUP-000010",
        "SUP-000011"
      ],
      "active_alternatives": [
        "SUP-000011"
      ],
      "sole_source": false,
      "mitigation": {
        "status": "APPROVED",
        "reason": "High dependency while transfer validation completes",
        "owner_id": "USR-CAT-10",
        "due_at": "2026-09-15T12:00:00+00:00",
        "approved_by": "USR-RISK-12",
        "market_retest_due": "2026-09-01T12:00:00+00:00"
      },
      "owner_id": "USR-CAT-10",
      "next_review_due": "2026-08-19T12:00:00+00:00"
    },
    {
      "category_id": "CAT-SUP",
      "name": "Ancillary support",
      "critical": false,
      "annual_spend": 150000,
      "primary_supplier_id": "SUP-000012",
      "approved_supplier_ids": [
        "SUP-000012"
      ],
      "active_alternatives": [],
      "sole_source": true,
      "mitigation": {
        "status": "APPROVED",
        "reason": "Low consequence service",
        "owner_id": "USR-CAT-11",
        "due_at": "2026-10-01T12:00:00+00:00",
        "approved_by": "USR-RISK-12",
        "market_retest_due": "2026-09-15T12:00:00+00:00"
      },
      "owner_id": "USR-CAT-11",
      "next_review_due": "2026-09-15T12:00:00+00:00"
    }
  ],
  "concentration": {
    "hhi": 4150,
    "max_supplier_percent": 55,
    "top_three_percent": 100,
    "critical_single_source_count": 0,
    "calculated_at": "2026-07-19T12:00:00+00:00",
    "calculation_source": "PROJECT_GENESIS"
  },
  "resilience": {
    "rating": "RED",
    "open_actions": [
      {
        "action_id": "ACT-DIV-001",
        "category_id": "CAT-SPEC",
        "owner_id": "USR-CAT-10",
        "due_at": "2026-09-15T12:00:00+00:00",
        "status": "OPEN"
      }
    ],
    "owner_id": "USR-RISK-11",
    "next_review_due": "2026-08-19T12:00:00+00:00"
  },
  "governance": {
    "calculated_only": true,
    "human_review_required": true,
    "automatic_award": false,
    "reviewer_id": "USR-RISK-11",
    "approver_id": "USR-RISK-12",
    "reviewed_at": "2026-07-19T12:00:00+00:00",
    "conflicts_declared": true
  },
  "audit_trail": {
    "immutable_history": true,
    "events": [
      {
        "event_id": "EVT-PORT-001",
        "event": "PORTFOLIO_REVIEWED",
        "at": "2026-07-19T12:00:00+00:00",
        "actor_id": "USR-RISK-01"
      }
    ]
  }
}
